id,titulo,descripcion,created_at,updated_at
1,"Las mujeres un mundo descriptivo","<p>Lorem ipsum dolor sit amet, consectetuer adipiscing elit. Aenean commodo ligula eget dolor. Aenean massa. Cum sociis natoque penatibus et magnis dis parturient montes, nascetur ridiculus mus. Donec quam felis, ultricies nec, pellentesque eu, pretium quis, sem. Nulla consequat massa quis enim. Donec pede justo, fringilla vel, aliquet nec, vulputate eget, arcu. In enim justo, rhoncus ut, imperdiet a, venenatis vitae, justo. Nullam dictum felis eu pede mollis pretium. Integer tincidunt. Cras dapibus. Vivamus elementum semper nisi. Aenean vulputate eleifend tellus.&nbsp;</p>","2025-05-22 22:54:45","2025-05-22 22:54:45"
2,"Los Docentes una fuente importante","<p>Lorem ipsum dolor sit amet, consectetuer adipiscing elit. Aenean commodo ligula eget dolor. Aenean massa. Cum sociis natoque penatibus et magnis dis parturient montes, nascetur ridiculus mus. Donec quam felis, ultricies nec, pellentesque eu, pretium quis, sem. Nulla consequat massa quis enim. Donec pede justo, fringilla vel, aliquet nec, vulputate eget, arcu. In enim justo, rhoncus ut, imperdiet a, venenatis vitae, justo. Nullam dictum felis eu pede mollis pretium. Integer tincidunt. Cras dapibus. Vivamus elementum semper nisi. Aenean vulputate eleifend tellus.&nbsp;</p>","2025-05-22 22:55:20","2025-05-22 22:55:20"
3,"La escuela siempre fuerte","<p>Lorem ipsum dolor sit amet, consectetuer adipiscing elit. Aenean commodo ligula eget dolor. Aenean massa. Cum sociis natoque penatibus et magnis dis parturient montes, nascetur ridiculus mus. Donec quam felis, ultricies nec, pellentesque eu, pretium quis, sem. Nulla consequat massa quis enim. Donec pede justo, fringilla vel, aliquet nec, vulputate eget, arcu. In enim justo, rhoncus ut, imperdiet a, venenatis vitae, justo. Nullam dictum felis eu pede mollis pretium. Integer tincidunt. Cras dapibus. Vivamus elementum semper nisi. Aenean vulputate eleifend tellus.&nbsp;</p>","2025-05-22 22:55:41","2025-05-22 22:58:15"
4,"La inteligencia artificial en la educación","<p>La Inteligencia Artificial (IA) está transformando la educación al permitir personalización del aprendizaje, automatización de tareas administrativas, y herramientas para el apoyo a la enseñanza y la evaluación. Estas tecnologías pueden adaptar el contenido y el ritmo de aprendizaje a las necesidades individuales de cada estudiante, ofreciendo retroalimentación inmediata y detectando dificultades de aprendizaje.&nbsp;</p>","2025-05-28 19:37:53","2025-05-28 19:37:53"
5,"Programación una matería para todos","<p>Sugiere que la programación debería ser una habilidad básica para todos, no solo para los que se especializan en informática.</p>","2025-05-28 19:38:53","2025-05-28 19:38:53"
7,"Cartilla de Derechos de las Mujeres y Tejedoras de la Patria","<p>Promover acciones de manera transversal en la agenda de nuestra organización Sindical, enfocadas al respeto de los derechos fundamentales de las personas, la eliminación de todas las formas de violencia y discriminación, que contribuyen a generar una nueva cultura de igualdad de derechos y oportunidades.</p>","2025-06-06 16:01:56","2025-06-06 16:04:37"
